{
  "$schema": "https://json-schema.org/draft/2020-12/schema",
  "$id": "https://cascabel.example/schemas/actividad.schema.json",
  "title": "Actividad de Cascabel",
  "description": "Descripción declarativa de una actividad. El motor la ejecuta; nadie programa una actividad a mano.",
  "type": "object",
  "required": [
    "id",
    "version",
    "tipo",
    "titulo",
    "etapa",
    "eje",
    "curriculo",
    "entrada",
    "contenido"
  ],
  "additionalProperties": false,
  "properties": {
    "id": {
      "type": "string",
      "pattern": "^[a-z0-9]+(-[a-z0-9]+)*$",
      "description": "Identificador estable. Nunca se reutiliza ni se renombra: puede estar en una URL compartida."
    },
    "version": {
      "type": "integer",
      "minimum": 1
    },
    "tipo": {
      "type": "string",
      "enum": [
        "eleccion",
        "emparejar",
        "ordenar",
        "rejilla",
        "pentagrama",
        "seguir",
        "tocar-a-tiempo",
        "cantar",
        "lienzo",
        "guia-aula",
        "teclado",
        "karaoke",
        "compases",
        "escala",
        "paisaje",
        "pistas",
        "cuerpo",
        "pads",
        "referencia",
        "acompanamientos",
        "eco"
      ],
      "description": ". 'teclado' se anadio el 2026-09-06 tras la investigacion de docs/11-RECURSOS-Y-REFERENTES.md: es un piano en pantalla sobre el Sampler que ya existe. 'karaoke' se anadio el mismo dia: musicograma que avanza de derecha a izquierda sobre un pentagrama y se toca a tiempo. 'compases' se anadio el 2026-09-07: poner las divisorias a una linea de figuras, que es de lo poco del lenguaje musical que se comprueba solo. 'escala' se anadio el 2026-09-07: teclado y pentagrama enlazados para construir una escala y ver donde caen los semitonos. 'paisaje' se anadio el 2026-09-07: es la UNICA que guarda audio, con las cuatro condiciones de docs/08-LEGAL.md. 'pistas' se anadio el 2026-09-07: componer con varias voces a la vez, que es lo que permite ensenar textura y funcion. 'cuerpo' se anadio el 2026-09-07: percusion corporal con notacion propia, porque la del metodo BAPNE esta registrada."
    },
    "titulo": {
      "type": "string",
      "minLength": 3,
      "maxLength": 70
    },
    "descripcion": {
      "type": "string",
      "maxLength": 400
    },
    "etapa": {
      "type": "string",
      "enum": [
        "infantil",
        "primaria-c1",
        "primaria-c2",
        "primaria-c3"
      ],
      "description": "infantil = 3-6; c1 = 1.º-2.º; c2 = 3.º-4.º; c3 = 5.º-6.º"
    },
    "eje": {
      "type": "string",
      "enum": [
        "pulso",
        "altura",
        "timbre",
        "notacion",
        "cuerpo",
        "creacion",
        "cultura"
      ]
    },
    "lugar": {
      "type": "string",
      "enum": [
        "pantalla",
        "hibrida",
        "fuera"
      ],
      "default": "pantalla",
      "description": "hibrida = pantalla del maestro + cuerpo; fuera = la pantalla solo guía."
    },
    "duracion_min": {
      "type": "integer",
      "minimum": 1,
      "maximum": 60,
      "description": "Minutos que dura la actividad. El tope de 60 es para una sesion de aula completa (guia-aula). Para una actividad de pantalla el limite real es de 20 minutos y lo comprueba tools/validar.py, porque es una regla de producto sobre tiempo de pantalla infantil y no una restriccion de formato."
    },
    "curriculo": {
      "type": "object",
      "description": "CAPA NORMATIVA. Solo etiquetas literales del real decreto. Si no estás seguro, null.",
      "required": [
        "competencia"
      ],
      "additionalProperties": false,
      "properties": {
        "area": {
          "type": "string",
          "enum": [
            "Educación Artística",
            "Comunicación y Representación de la Realidad",
            "Descubrimiento y Exploración del Entorno"
          ]
        },
        "competencia": {
          "type": [
            "string",
            "null"
          ],
          "enum": [
            "CE1",
            "CE2",
            "CE3",
            "CE4",
            "CE5",
            null
          ]
        },
        "criterio": {
          "type": [
            "string",
            "null"
          ],
          "pattern": "^[1-5]\\.[1-7]$"
        },
        "saber": {
          "type": [
            "string",
            "null"
          ],
          "maxLength": 160
        }
      }
    },
    "practica": {
      "type": "object",
      "description": "CAPA DE PRÁCTICA. Convención pedagógica, NO currículo. El RD nunca nombra una figura.",
      "additionalProperties": false,
      "properties": {
        "figuras": {
          "type": "array",
          "items": {
            "type": "string",
            "enum": [
              "redonda",
              "blanca",
              "negra",
              "corchea",
              "semicorchea",
              "silencio-redonda",
              "silencio-blanca",
              "silencio-negra",
              "silencio-corchea",
              "puntillo",
              "ligadura",
              "sincopa",
              "tresillo"
            ]
          }
        },
        "notas": {
          "type": "array",
          "items": {
            "type": "string",
            "pattern": "^(do|re|mi|fa|sol|la|si)('|,)?(#|b)?$"
          }
        },
        "secuencia": {
          "type": "string",
          "enum": [
            "vocal-kodaly",
            "flauta",
            "laminas",
            "ninguna"
          ],
          "description": "Las progresiones vocal y de flauta NO coinciden. No las mezcles."
        },
        "compas": {
          "type": "string",
          "enum": [
            "2/4",
            "3/4",
            "4/4",
            "6/8",
            "libre"
          ]
        },
        "tempo": {
          "type": "integer",
          "minimum": 40,
          "maximum": 180
        },
        "tesitura": {
          "type": "object",
          "additionalProperties": false,
          "properties": {
            "min": {
              "type": "string"
            },
            "max": {
              "type": "string"
            }
          }
        },
        "metodo": {
          "type": "array",
          "items": {
            "type": "string",
            "enum": [
              "orff",
              "kodaly",
              "dalcroze",
              "willems",
              "montessori",
              "bapne"
            ]
          }
        }
      }
    },
    "musica": {
      "type": "object",
      "additionalProperties": false,
      "properties": {
        "abc": {
          "type": "string",
          "description": "Notación ABC. Es lo que se renderiza y lo que valida music21."
        },
        "audio": {
          "type": "string",
          "pattern": "^[a-z0-9/_-]+\\.opus$"
        },
        "acompanamiento": {
          "type": "string",
          "pattern": "^[a-z0-9/_-]+\\.opus$"
        }
      }
    },
    "entrada": {
      "type": "object",
      "required": [
        "modo"
      ],
      "additionalProperties": false,
      "properties": {
        "modo": {
          "type": "string",
          "enum": [
            "toque",
            "toque-secuencial",
            "arrastre",
            "microfono-voz",
            "microfono-palmada",
            "ninguna"
          ]
        },
        "alternativa": {
          "type": "string",
          "enum": [
            "toque",
            "toque-secuencial",
            "sin-grabar",
            "ninguna"
          ],
          "description": "Que se hace cuando no hay microfono. 'toque' y 'toque-secuencial' son la misma actividad por otra via. 'sin-grabar' es para las actividades cuyo producto ES una grabacion: ahi no hay toque que la sustituya, pero la actividad se hace igual sin grabar, que es la parte que ensena a escuchar. 'ninguna' significa que no hay salida, y eso solo vale si la actividad no usa microfono."
        }
      },
      "allOf": [
        {
          "if": {
            "properties": {
              "modo": {
                "enum": [
                  "microfono-voz",
                  "microfono-palmada",
                  "arrastre"
                ]
              }
            }
          },
          "then": {
            "required": [
              "alternativa"
            ]
          }
        }
      ]
    },
    "contenido": {
      "type": "object",
      "description": "Carga útil específica del tipo. El motor la interpreta.",
      "minProperties": 1
    },
    "evaluacion": {
      "type": "object",
      "additionalProperties": false,
      "properties": {
        "autocorrectiva": {
          "type": "boolean",
          "default": true
        },
        "tolerancia_ms": {
          "type": "object",
          "additionalProperties": false,
          "properties": {
            "perfecto": {
              "type": "integer",
              "minimum": 40,
              "maximum": 200
            },
            "bien": {
              "type": "integer",
              "minimum": 60,
              "maximum": 300
            },
            "casi": {
              "type": "integer",
              "minimum": 100,
              "maximum": 500
            }
          }
        },
        "tolerancia_cents": {
          "type": "integer",
          "minimum": 20,
          "maximum": 150
        },
        "reporta": {
          "type": "array",
          "items": {
            "type": "string",
            "enum": [
              "aciertos",
              "desvio_medio_con_signo",
              "desviacion_tipica",
              "afinacion_media",
              "completado"
            ]
          }
        }
      }
    },
    "enunciado": {
      "type": "string",
      "description": "Clave de i18n con la frase que se le dice al nino, nunca texto literal. La lee un adulto en voz alta y sale en la ficha del maestro. Se llamaba 'locucion' y llevaba un campo 'audio' para una grabacion; el 2026-09-08 se decidio que no va a haber grabaciones, y un nombre que promete audio para algo que es texto es la clase de mentira que se queda para siempre. Ver docs/adr/0006."
    },
    "personaje": {
      "type": "string",
      "enum": [
        "dora",
        "rex",
        "milo",
        "fara",
        "sol",
        "laia",
        "simon",
        "doby"
      ],
      "description": "Que personaje de cocomusic presenta la actividad. Por defecto Dora, que es la primera de la progresion. Se elige por lo que la actividad TRABAJA, no por gusto: Rex descubre, Fara calla, Milo juega con el ritmo, Simon escucha. Ver docs/14-PERSONAJES.md."
    },
    "pistas": {
      "type": "array",
      "maxItems": 3,
      "items": {
        "type": "string",
        "description": "Clave de i18n. Reparadoras, nunca punitivas."
      }
    },
    "creditos": {
      "type": "array",
      "description": "Todo material de terceros usado por esta actividad. Alimenta CREDITS.md.",
      "items": {
        "type": "object",
        "required": [
          "obra",
          "licencia"
        ],
        "additionalProperties": false,
        "properties": {
          "obra": {
            "type": "string"
          },
          "autor": {
            "type": "string"
          },
          "fuente": {
            "type": "string"
          },
          "licencia": {
            "type": "string",
            "enum": [
              "CC0",
              "CC BY 4.0",
              "CC BY-SA 4.0",
              "OFL-1.1",
              "Apache-2.0",
              "MIT",
              "Dominio público",
              "Propia"
            ]
          }
        }
      }
    },
    "estado": {
      "type": "string",
      "enum": [
        "borrador",
        "revision-pedagogica",
        "publicada"
      ],
      "default": "borrador"
    },
    "ficha": {
      "type": "object",
      "description": "Textos propios del dosier imprimible. Opcional: sin esto se usa la guia generica del tipo de actividad.",
      "additionalProperties": false,
      "properties": {
        "comoFunciona": {
          "type": "string",
          "maxLength": 600
        },
        "sinPantalla": {
          "type": "string",
          "maxLength": 600
        },
        "ampliacion": {
          "type": "string",
          "maxLength": 600
        },
        "refuerzo": {
          "type": "string",
          "maxLength": 600
        },
        "observar": {
          "type": "string",
          "maxLength": 600
        },
        "indicador1": {
          "type": "string",
          "maxLength": 600
        },
        "indicador2": {
          "type": "string",
          "maxLength": 600
        },
        "indicador3": {
          "type": "string",
          "maxLength": 600
        }
      }
    },
    "herramienta": {
      "type": "boolean",
      "description": "Si esta actividad es tambien un instrumento o una herramienta de aula: algo que se usa libremente, sin solucion ni final. Aparece en la pantalla de Instrumentos. Una que ademas tenga criterio curricular sale tambien en el catalogo, y eso no es duplicar: es que es las dos cosas."
    }
  },
  "allOf": [
    {
      "if": {
        "properties": {
          "etapa": {
            "const": "infantil"
          }
        },
        "required": [
          "etapa"
        ]
      },
      "then": {
        "properties": {
          "entrada": {
            "properties": {
              "modo": {
                "not": {
                  "const": "arrastre"
                },
                "description": "Por debajo de 6 años, solo tap. WCAG 2.5.7 y motricidad fina."
              }
            }
          }
        }
      }
    }
  ]
}
