{
  "id": "c2-34-palmea-con-blancas",
  "version": 1,
  "tipo": "tocar-a-tiempo",
  "titulo": "Palmea con blancas y corcheas",
  "descripcion": "Tres ritmos de dos compases con blancas, negras y corcheas. La blanca es una palmada y un hueco, y cada ritmo la pone en otro sitio.",
  "etapa": "primaria-c2",
  "eje": "pulso",
  "lugar": "pantalla",
  "duracion_min": 6,
  "curriculo": {
    "area": "Educación Artística",
    "competencia": "CE3",
    "criterio": "3.1",
    "saber": "D. Lenguajes y práctica musical"
  },
  "practica": {
    "secuencia": "ninguna",
    "compas": "4/4",
    "tempo": 88,
    "figuras": [
      "blanca",
      "negra",
      "corchea"
    ],
    "metodo": [
      "orff",
      "kodaly"
    ]
  },
  "entrada": {
    "modo": "microfono-palmada",
    "alternativa": "toque"
  },
  "contenido": {
    "consigna": "actividad.c234.consigna",
    "compases_escucha": 2,
    "compases_respuesta": 2,
    "tempo": 88,
    "ejercicios": [
      {
        "titulo": "actividad.c234.ej1",
        "silabas": [
          "ta-a",
          "ti-ti",
          "ta",
          "ta",
          "ti-ti",
          "ta-a"
        ]
      },
      {
        "titulo": "actividad.c234.ej2",
        "silabas": [
          "ta",
          "ta",
          "ta-a",
          "ti-ti",
          "ti-ti",
          "ta-a"
        ]
      },
      {
        "titulo": "actividad.c234.ej3",
        "silabas": [
          "ta-a",
          "ta-a",
          "ta",
          "ti-ti",
          "ta",
          "ta"
        ]
      }
    ]
  },
  "evaluacion": {
    "autocorrectiva": true,
    "reporta": [
      "aciertos",
      "desvio_medio_con_signo",
      "desviacion_tipica"
    ]
  },
  "enunciado": "actividad.c234.enunciado",
  "personaje": "milo",
  "pistas": [
    "actividad.c234.pista1",
    "actividad.c234.pista2"
  ],
  "creditos": [
    {
      "obra": "Percusión, láminas, piano, arpa, flauta dulce, saxofón, armónica y órgano",
      "autor": "Versilian Studios y colaboradores",
      "fuente": "https://github.com/sgossner/VCSL",
      "licencia": "CC0"
    }
  ],
  "estado": "borrador"
}
