{
  "id": "inf-23-sube-o-baja",
  "version": 1,
  "tipo": "eleccion",
  "titulo": "¿Sube o baja?",
  "descripcion": "Tres notas seguidas: o van subiendo o van bajando. La escalera de sonidos, para oírla antes de dibujarla.",
  "etapa": "infantil",
  "eje": "altura",
  "lugar": "pantalla",
  "duracion_min": 5,
  "curriculo": {
    "area": "Comunicación y Representación de la Realidad",
    "competencia": "CE2",
    "criterio": "2.1",
    "saber": "F. Lenguaje y expresión musical — el sonido, el silencio y sus cualidades"
  },
  "practica": {
    "secuencia": "ninguna"
  },
  "entrada": {
    "modo": "toque"
  },
  "contenido": {
    "consigna": "actividad.inf23.consigna",
    "opciones": [
      {
        "clave": "sube",
        "icono": "flecha-arriba",
        "color": "verde"
      },
      {
        "clave": "baja",
        "icono": "flecha-abajo",
        "color": "azul"
      }
    ],
    "estimulos": [
      {
        "notas": [
          "C4",
          "E4",
          "G4",
          "C5"
        ],
        "respuesta": "sube",
        "instrumento": "piano"
      },
      {
        "notas": [
          "C5",
          "G4",
          "E4",
          "C4"
        ],
        "respuesta": "baja",
        "instrumento": "trompeta"
      },
      {
        "notas": [
          "D5",
          "A4",
          "F4",
          "D4"
        ],
        "respuesta": "baja",
        "instrumento": "violin"
      },
      {
        "notas": [
          "D4",
          "F4",
          "A4",
          "D5",
          "F5"
        ],
        "respuesta": "sube",
        "instrumento": "clarinete"
      },
      {
        "notas": [
          "C4",
          "E4",
          "G4",
          "C5",
          "E5"
        ],
        "respuesta": "sube",
        "instrumento": "glockenspiel"
      },
      {
        "notas": [
          "E5",
          "C5",
          "G4",
          "E4"
        ],
        "respuesta": "baja",
        "instrumento": "flauta"
      }
    ],
    "instrumento": "xilofono"
  },
  "evaluacion": {
    "autocorrectiva": true,
    "reporta": [
      "completado"
    ]
  },
  "enunciado": "actividad.inf23.enunciado",
  "personaje": "rex",
  "pistas": [
    "actividad.inf23.pista1"
  ],
  "creditos": [
    {
      "obra": "Percusión, láminas, piano, arpa, flauta dulce, saxofón, armónica y órgano",
      "autor": "Versilian Studios y colaboradores",
      "fuente": "https://github.com/sgossner/VCSL",
      "licencia": "CC0"
    },
    {
      "obra": "Iconos",
      "autor": "OpenMoji · HfG Schwäbisch Gmünd",
      "fuente": "https://openmoji.org",
      "licencia": "CC BY-SA 4.0"
    },
    {
      "obra": "Melodías y ritmos de ejemplo",
      "autor": "Cascabel",
      "licencia": "Propia"
    }
  ],
  "estado": "borrador"
}
